{
  "schemaVersion": "1.0.0",
  "stableID": "aletheia:xrfcsv:8a3b5c7d9e1f2a4b6c8d0e2f4a6b8c0d2e4f6a8b0c2d4e6f8a0b2c4d6e8f0a2b",
  "contentHash": {
    "algorithm": "SHA-256",
    "value": "8a3b5c7d9e1f2a4b6c8d0e2f4a6b8c0d2e4f6a8b0c2d4e6f8a0b2c4d6e8f0a2b"
  },
  "metadata": {
    "fileType": "XRF-CSV",
    "originalFilename": "sample_artifact_001_xrf.csv",
    "byteSize": 245678,
    "captureDate": "2025-11-15T14:30:00Z",
    "captureDevice": "Bruker Tracer 5g",
    "captureOperator": "Dr. Sarah Chen",
    "captureLocation": {
      "name": "Field Museum Conservation Lab",
      "coordinates": {
        "latitude": 41.8662,
        "longitude": -87.6169
      }
    },
    "description": "XRF spectral scan of bronze artifact surface, 3 measurement points averaged",
    "tags": ["bronze", "ancient", "metallurgy", "provenance-study"],
    "sensitivityLevel": "RESTRICTED"
  },
  "custody": {
    "chain": [
      {
        "party": "Field Museum",
        "role": "CUSTODIAN",
        "action": "CREATED",
        "timestamp": "2025-11-15T14:30:00Z",
        "notes": "Initial XRF measurement"
      },
      {
        "party": "Dr. Sarah Chen",
        "role": "CUSTODIAN",
        "action": "SEALED",
        "timestamp": "2025-11-15T15:00:00Z",
        "notes": "Sealed for Aletheia analysis"
      }
    ],
    "currentCustodian": "Dr. Sarah Chen"
  },
  "consent": {
    "required": false,
    "scope": ["ANALYSIS", "PUBLICATION", "EDUCATIONAL"],
    "grantor": "Field Museum",
    "stewardApproval": {
      "required": false
    }
  },
  "signature": {
    "algorithm": "ED25519",
    "value": "EXAMPLE_SIGNATURE_BASE64_ENCODED",
    "signer": "did:key:z6MkhaXgBZDvotDkL5257faiztiGiC2QtKLGpbnnEGta2doK",
    "signedAt": "2025-11-15T15:00:00Z",
    "publicKeyRef": "https://aletheia.echo/keys/sarah_chen.pub"
  },
  "timestamp": {
    "authority": "freetsa.org",
    "value": "EXAMPLE_RFC3161_TOKEN",
    "issuedAt": "2025-11-15T15:00:05Z",
    "proofType": "RFC3161"
  },
  "echoMode": {
    "level": "L4",
    "reviewRequired": false
  }
}
